movie,url,themes,violence,language,drug_use,nudity,sex,consumer_advice
Parasite,https://www.classification.gov.au/titles/parasite,moderate,strong,moderate,very mild,very mild,moderate,Strong violence
1917,https://www.classification.gov.au/titles/1917-0,strong,moderate,moderate,none,none,mild,Strong war themes
All Quiet on the Western Front,https://www.classification.gov.au/titles/im-westen-nichts-neues,strong,strong,moderate,none,none,mild,Strong war themes and bloody violence
American Fiction,https://www.classification.gov.au/titles/american-fiction,mild,moderate,strong,moderate,none,moderate,Strong coarse language
Anatomy of a Fall,https://www.classification.gov.au/titles/anatomy-fall,strong,strong,moderate,none,mild,moderate,"Strong themes, suicide, references and violence"
Annie Hall,https://www.classification.gov.au/titles/annie-hall,,,,,,,The content is moderate in impact
Avatar The Way of Water,https://www.classification.gov.au/titles/avatar-way-water,moderate,moderate,moderate,none,mild,none,"Science fiction themes, action violence and coarse language"
Bad Boys for Life,https://www.classification.gov.au/titles/bad-boys-for-life,moderate,strong,moderate,moderate,none,moderate,Strong violence and coarse language
Barbie,https://www.classification.gov.au/titles/barbie-1,mild,mild,mild,none,none,moderate,"Mild crude humour, innuendo, coarse language and slapstick violence"
Belfast,https://www.classification.gov.au/titles/belfast,mild,mild,mild,none,none,none,Mature themes and coarse language
Black Panther Wakanda Forever,https://www.classification.gov.au/titles/black-panther-wakanda-forever,moderate,moderate,mild,none,none,none,Mature themes and violence
Bob Marley One Love,https://www.classification.gov.au/titles/bob-marley-one-love,mild,moderate,moderate,mild,none,none,Violence and occasional coarse language
Chariots of Fire,https://www.classification.gov.au/titles/chariots-fire-1,,,,,,,The content is very mild in impact
CODA,https://www.classification.gov.au/titles/coda-1,mild,mild,moderate,mild,none,moderate,Coarse language and sex
Demon Slayer: Kimetsu No Yaiba - The Movie Mugen Train,https://www.classification.gov.au/titles/demon-slayer-kimetsu-no-yaiba-movie-mugen-train,strong,strong,mild,none,none,moderate,Strong supernatural themes and animated violence
Doctor Strange in the Multiverse of Madness,https://www.classification.gov.au/titles/doctor-strange-multiverse-madness,moderate,moderate,mild,none,none,none,Fantasy themes and action violence
Dolittle,https://www.classification.gov.au/titles/dolittle,mild,mild,very mild,none,none,none,Mild themes and violence
Dont Look Up,https://www.classification.gov.au/titles/dont-look-1,mild,mild,moderate,moderate,moderate,moderate,"Coarse language, sexual references, drug use and nudity"
Drive My Car,https://www.classification.gov.au/titles/drive-my-car-0,moderate,very mild,very mild,none,moderate,strong,Strong sex scenes
Dune,https://www.classification.gov.au/titles/dune-part-one,moderate,moderate,mild,none,none,very mild,Science fiction themes and violence
Dune: Part Two,https://www.classification.gov.au/titles/dune-part-two,moderate,moderate,mild,none,none,mild,Science fiction themes and violence
Elemental,https://www.classification.gov.au/titles/elemental-8,mild,none,mild,none,none,very mild,"Mild themes and occasional coarse language, some scenes may scare young children"
Elvis,https://www.classification.gov.au/titles/elvis-5,moderate,mild,moderate,mild,none,mild,Mature themes and coarse language
Everything Everywhere All At Once,https://www.classification.gov.au/titles/everything-everywhere-all-once,strong,strong,moderate,mild,none,strong,Strong violence and crude sexual humour
A Star is Born,https://www.classification.gov.au/titles/star-born,moderate,mild,moderate,moderate,moderate,moderate,"Mature themes, coarse language, drug use and sex scenes"
Aladdin,https://www.classification.gov.au/titles/aladdin,mild,mild,none,none,none,none,Mild fantasy themes
Aquaman,https://www.classification.gov.au/titles/aquaman,moderate,moderate,mild,none,none,none,Fantasy violence
Avengers Endgame,https://www.classification.gov.au/titles/avengers-endgame,mild,moderate,mild,none,none,none,Violence
Black Panther,https://www.classification.gov.au/titles/black-panther-5,moderate,moderate,mild,none,none,none,Action violence
BlacKKKlansman,https://www.classification.gov.au/titles/blackkklansman,moderate,moderate,strong,mild,none,moderate,Strong coarse language
Bohemian Rhapsody,https://www.classification.gov.au/titles/bohemian-rhapsody,mild,mild,moderate,mild,none,mild,Coarse language
Captain Marvel,https://www.classification.gov.au/titles/captain-marvel,moderate,moderate,mild,none,none,none,Action violence
F9 The Fast Saga,https://www.classification.gov.au/titles/fast-furious-9,moderate,moderate,mild,mild,none,mild,Action violence
Fast10,https://www.classification.gov.au/titles/fast-x-0,moderate,moderate,mild,mild,none,very mild,Action violence
Ford v Ferrari,https://www.classification.gov.au/titles/ford-v-ferrari,mild,mild,moderate,none,none,very mild,Coarse language
Frozen II,https://www.classification.gov.au/titles/frozen-ii,mild,very mild,very mild,none,none,none,Some scenes amy scare younger children
Ghostbusters Frozen Empire,https://www.classification.gov.au/titles/ghostbusters-frozen-empire,moderate,moderate,moderate,none,none,moderate,"Mild supernatural themes, sexual references and coarse language, some scenes may scare young children"
Godzilla vs Kong,https://www.classification.gov.au/titles/godzilla-vs-kong,moderate,moderate,mild,none,none,none,Science fiction themes and action violence
Godzilla x Kong The New Empire,https://www.classification.gov.au/titles/godzilla-x-kong-new-empire,moderate,moderate,mild,none,none,none,Science fiction themes and violence
Green Book,https://www.classification.gov.au/titles/green-book,mild,mild,moderate,none,none,mild,Coarse language
Guardians of the Galaxy Vol. 3,https://www.classification.gov.au/titles/guardians-galaxy-vol-3,moderate,moderate,moderate,mild,none,mild,"Intense scenes of violence, science fiction themes and coarse language"
Jojo Rabbit,https://www.classification.gov.au/titles/jojo-rabbit-0,moderate,moderate,moderate,none,none,mild,"Mature themes, violence and coarse language"
Joker,https://www.classification.gov.au/titles/joker-7,moderate,strong,moderate,none,moderate,moderate,Strong violence
Judas and the Black Messiah,https://www.classification.gov.au/titles/judas-and-black-messiah,moderate,strong,strong,none,none,none,Strong violence and coarse language
Jumanji The Next Level,https://www.classification.gov.au/titles/jumanji-next-level,moderate,moderate,moderate,none,none,very mild,"Mild fantasy violence, coarse language and crude humour"
Jurassic World Dominion,https://www.classification.gov.au/titles/jurassic-world-dominion,moderate,moderate,mild,none,none,none,Sustained threat and action violence
Killers of the Flower Moon,https://www.classification.gov.au/titles/killers-flower-moon,strong,moderate,moderate,none,none,mild,Strong injury detail and suicide references
King Richard,https://www.classification.gov.au/titles/king-richard,moderate,moderate,moderate,mild,none,moderate,"Mature themes, violence and coarse language"
Kung Fu Panda 4,https://www.classification.gov.au/titles/kung-fu-panda-4-0,mild,mild,mild,none,none,none,"Mild fantasy themes, animated violence and occasional coarse language"
Licorice Pizza,https://www.classification.gov.au/titles/licorice-pizza,mild,very mild,moderate,mild,none,mild,Coarse language and sexual references
Little Women,https://www.classification.gov.au/titles/little-women-7,very mild,very mild,none,none,none,none,Very mild themes
Maestro,https://www.classification.gov.au/titles/maestro-4,mild,very mild,moderate,moderate,none,mild,"Coarse language and drug use"
Mank,https://www.classification.gov.au/titles/mank,moderate,very mild,moderate,none,none,mild,Mature themes and coarse language
Marriage Story,https://www.classification.gov.au/titles/marriage-story,moderate,none,moderate,mild,none,moderate,"Mature themes, coarse language and sexual references"
Minions The Rise of Gru,https://www.classification.gov.au/titles/minions-rise-gru,moderate,moderate,none,none,very mild,none,Mild themes and animated violence
Mission Impossible - Dead Reckoning Part One,https://www.classification.gov.au/titles/mission-impossible-dead-reckoning-part-one,moderate,moderate,mild,none,none,very mild,Action violence
Nightmare Alley,https://www.classification.gov.au/titles/nightmare-alley,strong,strong,moderate,mild,very mild,moderate,Strong violence and injury detail
No Time To Die,https://www.classification.gov.au/titles/no-time-die-0,moderate,moderate,moderate,none,none,mild,"Mature themes, action violence and occasional coarse language"
Nomadland,https://www.classification.gov.au/titles/nomadland,mild,none,mild,none,moderate,none,Nudity
Once Upon a Time in Hollywood,https://www.classification.gov.au/titles/once-upon-time-hollywood,moderate,strong,moderate,moderate,none,moderate,Strong violence and coarse language
Oppenheimer,https://www.classification.gov.au/titles/oppenheimer,moderate,very mild,moderate,none,moderate,strong,Strong sex and a suicide scene
Past Lives,https://www.classification.gov.au/titles/past-lives,very mild,none,moderate,none,none,very mild,Coarse language
Poor Things,https://www.classification.gov.au/titles/poor-things,strong,mild,strong,mild,strong,strong,"Strong themes, sex, coarse language and nudity"
Promising Young Woman,https://www.classification.gov.au/titles/promising-young-woman,moderate,strong,strong,moderate,none,moderate,Strong coarse language and violence
Puss In Boots The Last Wish,https://www.classification.gov.au/titles/puss-boots-last-wish,moderate,moderate,moderate,none,none,none,"Mild themes, animated violence and coarse language, some scenes may scare young children"
Shang-Chi and The Legend of the Ten Rings,https://www.classification.gov.au/titles/shang-chi-and-legend-ten-rings,moderate,moderate,mild,very mild,none,none,Fantasy themes and violence
Sing 2,https://www.classification.gov.au/titles/sing-2-0,mild,mild,very mild,none,none,very mild,Some scenes may scare young children
Sonic the Hedgehog,https://www.classification.gov.au/titles/sonic-hedgehog-6,mild,mild,very mild,none,none,none,"Comedic action violence"
Sound of Metal,https://www.classification.gov.au/titles/sound-metal,moderate,none,moderate,mild,mild,mild,"Mature themes and coarse language"
Spider-Man Across the Spider-Verse,https://www.classification.gov.au/titles/spider-man-across-spider-verse,mild,mild,mild,none,none,none,"Mild science fiction themes, animated violence and coarse language"
Spider-Man Far From Home,https://www.classification.gov.au/titles/spider-man-far-home,moderate,moderate,mild,none,none,none,Action violence
Spider-Man No Way Home,https://www.classification.gov.au/titles/spider-man-no-way-home,mild,moderate,mild,none,none,very mild,Action violence
Star Wars Episode IX - The Rise of Skywalker,https://www.classification.gov.au/titles/star-wars-episode-ix-rise-skywalker,moderate,moderate,very mild,none,none,none,Science fiction violence
Tár,https://www.classification.gov.au/titles/tar-2,moderate,moderate,moderate,none,moderate,mild,"Mature themes, coarse language and brief nudity"
Tenet,https://www.classification.gov.au/titles/tenet,moderate,moderate,moderate,none,none,very mild,"Science fiction themes, violence and coarse language"
The Banshees of Inisherin,https://www.classification.gov.au/titles/banshees-inisherin,moderate,mild,moderate,none,moderate,mild,"Mature themes, coarse language, injury detail and brief nudity"
The Batman,https://www.classification.gov.au/titles/batman-7,moderate,moderate,moderate,mild,none,mild,"Sustained threat, violence and coarse language"
The Beekeeper,https://www.classification.gov.au/titles/beekeeper-2,moderate,strong,strong,moderate,none,mild,Strong action violence and coarse language
The Croods A New Age,https://www.classification.gov.au/titles/croods-new-age-0,moderate,moderate,very mild,none,none,none,Mild themes and animated violence
The Departed,https://www.classification.gov.au/titles/departed-1,,,,,,,"Strong violence and coarse language, Sexual references"
The Fabelmans,https://www.classification.gov.au/titles/fabelmans,moderate,moderate,moderate,mild,none,none,Mature themes and coarse language
The Fall Guy,https://www.classification.gov.au/titles/fall-guy-14,mild,moderate,moderate,mild,none,none,Action violence and coarse language
The Father,https://www.classification.gov.au/titles/father-2,moderate,mild,moderate,none,none,none,Mature themes and coarse language
The Favourite,https://www.classification.gov.au/titles/favourite,moderate,mild,strong,none,moderate,moderate,Strong coarse language
The Holdovers,https://www.classification.gov.au/titles/holdovers,moderate,mild,moderate,mild,mild,mild,Mature themes and coarse language
The Irishman,https://www.classification.gov.au/titles/irishman-2,moderate,strong,strong,moderate,none,none,Strong violence and coarse language
The Lion King,https://www.classification.gov.au/titles/lion-king-2019,mild,mild,none,none,none,none,Mild themes and violence
The Little Mermaid,https://www.classification.gov.au/titles/little-mermaid-13,mild,mild,none,none,none,none,"Mild fantasy themes and violence, some scenes may scare young children"
The Power of the Dog,https://www.classification.gov.au/titles/power-dog,moderate,mild,mild,none,mild,mild,Mature themes
The Silence of the Lambs,https://www.classification.gov.au/titles/silence-lambs-said-be-special-edition,,,,,,,"High level violence, Medium level coarse language"
The Super Mario Bros. Movie,https://www.classification.gov.au/titles/super-mario-bros-movie,moderate,moderate,none,none,none,none,"Mild fantasy themes and animated violence, some scenes may scare young children"
The Trial of the Chicago 7,https://www.classification.gov.au/titles/trial-chicago-7,moderate,moderate,strong,mild,none,moderate,Strong coarse language
The Zone of Interest,https://www.classification.gov.au/titles/zone-interest,moderate,moderate,very mild,none,none,very mild,Holocaust themes
Thor Love and Thunder,https://www.classification.gov.au/titles/thor-love-and-thunder,moderate,moderate,mild,none,mild,mild,Fantasy themes and action violence
Top Gun Maverick,https://www.classification.gov.au/titles/top-gun-maverick,mild,moderate,moderate,none,none,very mild,Violence and coarse language
Toy Story 4,https://www.classification.gov.au/titles/toy-story-4-0,very mild,very mild,none,none,none,none,"Some scenes may scare very young children"
Venom Let There Be Carnage,https://www.classification.gov.au/titles/venom-let-there-be-carnage,moderate,moderate,moderate,none,none,none,"Science fiction themes, violence and coarse language"
Vice,https://www.classification.gov.au/titles/vice-0,moderate,moderate,moderate,mild,mild,mild,Mature themes and coarse language
West Side Story,https://www.classification.gov.au/titles/west-side-story-0,moderate,moderate,mild,mild,none,mild,Violence
Wonka,https://www.classification.gov.au/titles/wonka,mild,mild,very mild,none,none,none,"Mild thems and violence, some scenes may scare young children"
Women Talking,https://www.classification.gov.au/titles/women-talking,moderate,moderate,moderate,none,none,none,"Pervasive themes of abuse, coarse language and frequent references to sexual violence"
The Accountant,https://www.classification.gov.au/titles/accountant,moderate,strong,moderate,mild,none,none,Strong violence
Heretic,https://www.classification.gov.au/titles/heretic-6,strong,strong,very mild,none,none,mild,Strong themes and violence
Plane,https://www.classification.gov.au/titles/plane-28,strong,strong,moderate,none,none,none,Strong violence
Anora,https://www.classification.gov.au/titles/anora,moderate,moderate,strong,moderate,strong,strong,"Strong frequent coarse language, sex scenes and nudity"
Better Man,https://www.classification.gov.au/titles/better-man-1,strong,moderate,strong,strong,moderate,moderate,"Strong coarse language, drug use and mental health themes"
The Apprentice,https://www.classification.gov.au/titles/apprentice-0,moderate,strong,strong,moderate,strong,strong,"Strong sexual violence, sex scenes and coarse language"
Saturday Night,https://www.classification.gov.au/titles/saturday-night-0,strong,mild,strong,moderate,moderate,moderate,Strong crude humour and coarse language
MaXXXine,https://www.classification.gov.au/titles/maxxxine,strong,strong,moderate,moderate,moderate,strong,"Strong violence and sex scenes, blood and gore"
The Substance,https://www.classification.gov.au/titles/substance-2,high,high,moderate,none,strong,moderate,"High impact violence, blood and gore"
Saltburn,https://www.classification.gov.au/titles/saltburn,strong,moderate,strong,moderate,strong,moderate,"Strong themes, suicide references, coarse language and nudity"
Babylon,https://www.classification.gov.au/titles/babylon-2,strong,strong,strong,strong,moderate,strong,"Strong themes, sexualised imagery, violence, drug use and coarse language"
Beautiful Boy,https://www.classification.gov.au/titles/beautiful-boy-0,moderate,none,moderate,strong,none,moderate,Strong drug use
Kingsman The Golden Circle,https://www.classification.gov.au/titles/kingsman-golden-circle,moderate,strong,moderate,moderate,none,strong,Strong violence and sex
The Crow,https://www.classification.gov.au/titles/crow-11,strong,strong,moderate,mild,mild,moderate,Strong bloody violence and injury detail
Monkey Man,https://www.classification.gov.au/titles/monkey-man-0,strong,strong,moderate,moderate,mild,moderate,Strong bloody violence
Moonlight,https://www.classification.gov.au/titles/moonlight-5,moderate,moderate,moderate,moderate,none,moderate,"Drug use, coarse language, sex and violence"
Booksmart,https://www.classification.gov.au/titles/booksmart,strong,mild,moderate,moderate,mild,strong,Strong crude sexual humour and coarse language
Dallas Buyers Club,https://www.classification.gov.au/titles/dallas-buyers-club,moderate,moderate,moderate,strong,moderate,strong,"Strong sex scenes, drug use and coarse language"
Out of the Furnace,https://www.classification.gov.au/titles/out-furnace,mild,strong,strong,strong,none,moderate,"Strong violence, coarse language and drug use"
Patriots Day,https://www.classification.gov.au/titles/patriots-day,moderate,moderate,moderate,moderate,none,mild,"Coarse language, violence, mature themes and drug use"
Barbarian,https://www.classification.gov.au/titles/barbarian-2,strong,strong,moderate,none,moderate,moderate,Strong horror violence and coarse language
The Wolf of Wall Street,https://www.classification.gov.au/titles/wolf-wall-street,strong,strong,strong,high,strong,high,High impact sex scenes and drug use
X,https://www.classification.gov.au/titles/x-7,strong,high,moderate,strong,strong,strong,High impact horror violence
Avengers Infinity War,https://www.classification.gov.au/titles/avengers-infinity-war,moderate,moderate,mild,none,none,very mild,Fantasy themes and violence
Deadpool 2,https://www.classification.gov.au/titles/deadpool-2,moderate,strong,strong,moderate,moderate,moderate,Strong bloody violence and coarse langauge
Fantastic Beasts The Crimes of Grindelwald,https://www.classification.gov.au/titles/fantastic-beasts-crimes-grindelwald,moderate,moderate,very mild,none,none,none,Fantasy themes and violence
Incredibles 2,https://www.classification.gov.au/titles/incredibles-2,mild,mild,mild,none,none,none,"Mild themes, animated violence and coarse language"
Jurassic World Fallen Kingdom,https://www.classification.gov.au/titles/jurassic-world-fallen-kingdom,moderate,moderate,moderate,none,none,none,Action violence
Mission Impossible - Fallout,https://www.classification.gov.au/titles/mission-impossible-fallout,moderate,moderate,moderate,none,none,very mild,Action violence and coarse language
Venom,https://www.classification.gov.au/titles/venom-0,moderate,moderate,moderate,none,none,very mild,"Science fiction themes, violence and coarse language"
Call Me By Your Name,https://www.classification.gov.au/titles/call-me-your-name-0,mild,none,moderate,none,moderate,moderate,"Sex scenes, nudity and coarse language"
Darkest Hour,https://www.classification.gov.au/titles/darkest-hour-2,mild,very mild,moderate,none,none,none,Mild themes and coarse language
Dunkirk,https://www.classification.gov.au/titles/dunkirk-0,moderate,moderate,moderate,none,none,none,"Mature themes, violence and coarse language"
Get Out,https://www.classification.gov.au/titles/get-out-6,strong,strong,moderate,none,none,moderate,Strong themes and violence
Lady Bird,https://www.classification.gov.au/titles/lady-bird-3,moderate,none,moderate,mild,none,moderate,"Mature themes, coarse language and a sex scene"
Phantom Thread,https://www.classification.gov.au/titles/phantom-thread,moderate,none,moderate,none,very mild,none,Mature themes and coarse language
The Post,https://www.classification.gov.au/titles/post-0,mild,mild,moderate,very mild,none,very mild,Coarse language
The Shape of Water,https://www.classification.gov.au/titles/shape-water,strong,strong,moderate,none,moderate,strong,"Strong themes, violence and a sex scene"
"Three Billboards Outside Ebbing, Missouri",https://www.classification.gov.au/titles/three-billboards-outside-ebbing-missouri,strong,moderate,strong,mild,none,moderate,Strong themes and coarse language
Beauty and the Beast,https://www.classification.gov.au/titles/beauty-and-beast-16,moderate,moderate,none,none,none,none,Mild themes and violence
Despicable Me 3,https://www.classification.gov.au/titles/despicable-me-3-0,moderate,moderate,very mild,none,very mild,none,Mild themes and animated violence
Guardians Of The Galaxy Vol 2,https://www.classification.gov.au/titles/guardians-galaxy-vol2,moderate,moderate,mild,none,none,mild,Science fiction themes and violence
Jumanji Welcome to the Jungle,https://www.classification.gov.au/titles/jumanji-welcome-jungle-0,mild,mild,mild,none,none,mild,"Mild fantasy violence, sexual references and coarse language"
Spider-Man Homecoming,https://www.classification.gov.au/titles/spider-man-homecoming,mild,moderate,mild,none,none,mild,Action violence
Star Wars Episode VIII - The Last Jedi,https://www.classification.gov.au/titles/star-wars-episode-viii-last-jedi,mild,moderate,mild,none,none,none,Science fiction violence
The Fate Of The Furious,https://www.classification.gov.au/titles/fate-furious,moderate,moderate,moderate,none,very mild,mild,Action violence and coarse language
Thor Ragnarok,https://www.classification.gov.au/titles/thor-ragnarok,moderate,moderate,mild,none,very mild,mild,Action violence
Wonder Woman,https://www.classification.gov.au/titles/wonder-woman,moderate,moderate,very mild,none,very mild,mild,Mature themes and action violence
Queer,https://www.classification.gov.au/titles/queer,moderate,mild,moderate,strong,moderate,strong,Strong drug use and sex scenes
A Good Person,https://www.classification.gov.au/titles/good-person,strong,mild,moderate,strong,none,moderate,Strong themes and drug use
Cocaine Bear,https://www.classification.gov.au/titles/cocaine-bear,strong,strong,moderate,strong,none,mild,"Strong blood and gore, animale attacks, violence and drug use"
Jackass Forever,https://www.classification.gov.au/titles/jackass-forever,strong,moderate,moderate,none,strong,none,"Strong crude humour, dangerous stunts, nudity and coarse language"
Infinity Pool,https://www.classification.gov.au/titles/infinity-pool,high,high,moderate,strong,high,high,"High impact horror violence, blood and gore, sex and nudity"
Ted 2,https://www.classification.gov.au/titles/ted-2,strong,mild,strong,strong,moderate,strong,"Strong drug use, crude humour, sexual references and coarse language"
Spiderhead,https://www.classification.gov.au/titles/spiderhead,strong,strong,moderate,moderate,mild,moderate,"Strong science fiction themes, violence and suicide scenes"
Side Effects,https://www.classification.gov.au/titles/side-effects,moderate,moderate,moderate,moderate,strong,strong,Strong sex scene
Arrival,https://www.classification.gov.au/titles/arrival-7,moderate,mild,moderate,none,none,very mild,Mature themes and coarse language
Fences,https://www.classification.gov.au/titles/fences-2,mild,mild,mild,none,none,mild,"Mild themes, sexual references and coarse language"
Hacksaw Ridge,https://www.classification.gov.au/titles/hacksaw-ridge,strong,strong,mild,none,mild,very mild,"Strong battle violence, blood and gore"
Hell Or High Water,https://www.classification.gov.au/titles/hell-or-high-water-0,moderate,strong,moderate,very mild,moderate,moderate,Strong violence
Hidden Figures,https://www.classification.gov.au/titles/hidden-figures,mild,none,mild,none,none,very mild,Mild themes and coarse language
La La Land,https://www.classification.gov.au/titles/la-la-land-0,very mild,none,moderate,none,none,none,Coarse language
Lion,https://www.classification.gov.au/titles/lion-6,mild,very mild,none,mild,none,none,Mild themes
Manchester By The Sea,https://www.classification.gov.au/titles/manchester-sea-0,moderate,moderate,moderate,mild,none,moderate,"Mature themes, coarse language, violence and sexual references"
Batman V Superman Dawn of Justice,https://www.classification.gov.au/titles/batman-v-superman-dawn-justice,moderate,moderate,mild,none,mild,very mild,Intense sequences of violence and mature themes
Captain America Civil War,https://www.classification.gov.au/titles/captain-america-civil-war-0,moderate,moderate,mild,none,none,none,Action violence
Deadpool,https://www.classification.gov.au/titles/deadpool-0,moderate,strong,moderate,mild,moderate,strong,Strong bloody violence and sex scene
